{"$id":"https://github.com/afflom/lexlean/schemas/source-map.schema.json","$schema":"https://json-schema.org/draft/2020-12/schema","additionalProperties":false,"properties":{"artifacts":{"items":{"additionalProperties":false,"properties":{"id":{"minimum":0,"type":"integer"},"kind":{"enum":["lean","tex"]},"path":{"minLength":1,"type":"string"}},"required":["id","kind","path"],"type":"object"},"type":"array"},"mappings":{"items":{"additionalProperties":false,"properties":{"artifact":{"minimum":0,"type":"integer"},"gen_end":{"minimum":0,"type":"integer"},"gen_start":{"minimum":0,"type":"integer"},"node":{"minimum":0,"type":"integer"},"role":{"enum":["declaration","binder","term","proof","structure","renderer","synthetic"]},"source":{"minimum":0,"type":"integer"},"src_end":{"minimum":0,"type":"integer"},"src_start":{"minimum":0,"type":"integer"}},"required":["artifact","gen_end","gen_start","node","role","source"],"type":"object"},"type":"array"},"module":{"minLength":1,"type":"string"},"nodes":{"items":{"additionalProperties":false,"properties":{"id":{"minimum":0,"type":"integer"},"kind":{"minLength":1,"type":"string"}},"required":["id","kind"],"type":"object"},"type":"array"},"semantic_id":{"pattern":"^[0-9a-f]{64}$","type":"string"},"source_id":{"pattern":"^[0-9a-f]{64}$","type":"string"},"sources":{"items":{"oneOf":[{"additionalProperties":false,"properties":{"id":{"minimum":0,"type":"integer"},"kind":{"const":"file"},"path":{"minLength":1,"type":"string"},"sha256":{"pattern":"^[0-9a-f]{64}$","type":"string"}},"required":["id","kind","path","sha256"],"type":"object"},{"additionalProperties":false,"properties":{"entry":{"minLength":1,"type":"string"},"id":{"minimum":0,"type":"integer"},"kind":{"const":"glossary"},"package":{"minLength":1,"type":"string"}},"required":["entry","id","kind","package"],"type":"object"},{"additionalProperties":false,"properties":{"id":{"minimum":0,"type":"integer"},"kind":{"const":"synthetic"},"origin":{"minLength":1,"type":"string"}},"required":["id","kind","origin"],"type":"object"}]},"type":"array"},"spec":{"const":"lexlean/source-map/1"}},"required":["artifacts","mappings","module","nodes","semantic_id","source_id","sources","spec"],"title":"LexLean module source map (SPEC.md §20.3)","type":"object"}
