{"artifacts":[{"id":0,"kind":"lean","path":"modules/LexLeanExample/ClosurePairCert9.lean"},{"id":1,"kind":"tex","path":"modules/LexLeanExample/ClosurePairCert9.tex"}],"mappings":[{"artifact":0,"gen_end":16097,"gen_start":0,"node":0,"role":"declaration","source":0,"src_end":2447,"src_start":156},{"artifact":1,"gen_end":226,"gen_start":0,"node":1,"role":"declaration","source":0,"src_end":2447,"src_start":156},{"artifact":1,"gen_end":483,"gen_start":226,"node":2,"role":"declaration","source":0,"src_end":2447,"src_start":156},{"artifact":1,"gen_end":918,"gen_start":483,"node":3,"role":"declaration","source":0,"src_end":2447,"src_start":156},{"artifact":1,"gen_end":933,"gen_start":918,"node":4,"role":"declaration","source":0,"src_end":2447,"src_start":156}],"module":"ClosurePairCert9","nodes":[{"id":0,"kind":"core-lean-kernel-module"},{"id":1,"kind":"core-latex-preamble"},{"id":2,"kind":"core-declaration"},{"id":3,"kind":"core-declaration"},{"id":4,"kind":"core-latex-preamble"}],"semantic_id":"81ff612be4fa60f29943cb909f939621a264c89b495b4df9f1ba7d2de6bfb79f","source_id":"1e378f46301f062082f2cdd0c22bcea7fdf43bd88a364b4cdc251499f638241c","sources":[{"id":0,"kind":"file","path":"src/ClosurePairCert9.lex.tex","sha256":"68ab736d58bc7cc6a6b67bcdf0fbad91903f9a674d940b1adf47d221d2f1ab00"}],"spec":"lexlean/source-map/1"}
