{"artifacts":[{"id":0,"kind":"lean","path":"modules/LexLeanExample/CensusCert8.lean"},{"id":1,"kind":"tex","path":"modules/LexLeanExample/CensusCert8.tex"}],"mappings":[{"artifact":0,"gen_end":15405,"gen_start":0,"node":0,"role":"declaration","source":0,"src_end":1906,"src_start":122},{"artifact":1,"gen_end":226,"gen_start":0,"node":1,"role":"declaration","source":0,"src_end":1906,"src_start":122},{"artifact":1,"gen_end":660,"gen_start":226,"node":2,"role":"declaration","source":0,"src_end":1906,"src_start":122},{"artifact":1,"gen_end":904,"gen_start":660,"node":3,"role":"declaration","source":0,"src_end":1906,"src_start":122},{"artifact":1,"gen_end":919,"gen_start":904,"node":4,"role":"declaration","source":0,"src_end":1906,"src_start":122}],"module":"CensusCert8","nodes":[{"id":0,"kind":"core-lean-kernel-module"},{"id":1,"kind":"core-latex-preamble"},{"id":2,"kind":"core-declaration"},{"id":3,"kind":"core-declaration"},{"id":4,"kind":"core-latex-preamble"}],"semantic_id":"ad54da230572e2b75dd957708d69d6e4ceeb6b69e1c34476a773fef2fe445000","source_id":"12a0e5a1368d03256983976c9e387d500077eea79d850a286463c9423ed84983","sources":[{"id":0,"kind":"file","path":"src/CensusCert8.lex.tex","sha256":"e32bb50b06f51de05076345aa6a0a910e60c0403afe790fd35e8e0c8cfb7be9b"}],"spec":"lexlean/source-map/1"}
