{"artifacts":[{"id":0,"kind":"lean","path":"modules/LexLeanExample/Parameters.lean"},{"id":1,"kind":"tex","path":"modules/LexLeanExample/Parameters.tex"}],"mappings":[{"artifact":0,"gen_end":110437,"gen_start":0,"node":0,"role":"declaration","source":0,"src_end":75698,"src_start":92},{"artifact":1,"gen_end":226,"gen_start":0,"node":1,"role":"declaration","source":0,"src_end":75698,"src_start":92},{"artifact":1,"gen_end":1478,"gen_start":226,"node":2,"role":"declaration","source":0,"src_end":75698,"src_start":92},{"artifact":1,"gen_end":1691,"gen_start":1478,"node":3,"role":"declaration","source":0,"src_end":75698,"src_start":92},{"artifact":1,"gen_end":2001,"gen_start":1691,"node":4,"role":"declaration","source":0,"src_end":75698,"src_start":92},{"artifact":1,"gen_end":15310,"gen_start":2001,"node":5,"role":"declaration","source":0,"src_end":75698,"src_start":92},{"artifact":1,"gen_end":16385,"gen_start":15310,"node":6,"role":"declaration","source":0,"src_end":75698,"src_start":92},{"artifact":1,"gen_end":16599,"gen_start":16385,"node":7,"role":"declaration","source":0,"src_end":75698,"src_start":92},{"artifact":1,"gen_end":16813,"gen_start":16599,"node":8,"role":"declaration","source":0,"src_end":75698,"src_start":92},{"artifact":1,"gen_end":17545,"gen_start":16813,"node":9,"role":"declaration","source":0,"src_end":75698,"src_start":92},{"artifact":1,"gen_end":19373,"gen_start":17545,"node":10,"role":"declaration","source":0,"src_end":75698,"src_start":92},{"artifact":1,"gen_end":20816,"gen_start":19373,"node":11,"role":"declaration","source":0,"src_end":75698,"src_start":92},{"artifact":1,"gen_end":21168,"gen_start":20816,"node":12,"role":"declaration","source":0,"src_end":75698,"src_start":92},{"artifact":1,"gen_end":22864,"gen_start":21168,"node":13,"role":"declaration","source":0,"src_end":75698,"src_start":92},{"artifact":1,"gen_end":23625,"gen_start":22864,"node":14,"role":"declaration","source":0,"src_end":75698,"src_start":92},{"artifact":1,"gen_end":24976,"gen_start":23625,"node":15,"role":"declaration","source":0,"src_end":75698,"src_start":92},{"artifact":1,"gen_end":25190,"gen_start":24976,"node":16,"role":"declaration","source":0,"src_end":75698,"src_start":92},{"artifact":1,"gen_end":26269,"gen_start":25190,"node":17,"role":"declaration","source":0,"src_end":75698,"src_start":92},{"artifact":1,"gen_end":26714,"gen_start":26269,"node":18,"role":"declaration","source":0,"src_end":75698,"src_start":92},{"artifact":1,"gen_end":29774,"gen_start":26714,"node":19,"role":"declaration","source":0,"src_end":75698,"src_start":92},{"artifact":1,"gen_end":30062,"gen_start":29774,"node":20,"role":"declaration","source":0,"src_end":75698,"src_start":92},{"artifact":1,"gen_end":30622,"gen_start":30062,"node":21,"role":"declaration","source":0,"src_end":75698,"src_start":92},{"artifact":1,"gen_end":31892,"gen_start":30622,"node":22,"role":"declaration","source":0,"src_end":75698,"src_start":92},{"artifact":1,"gen_end":38350,"gen_start":31892,"node":23,"role":"declaration","source":0,"src_end":75698,"src_start":92},{"artifact":1,"gen_end":39313,"gen_start":38350,"node":24,"role":"declaration","source":0,"src_end":75698,"src_start":92},{"artifact":1,"gen_end":39526,"gen_start":39313,"node":25,"role":"declaration","source":0,"src_end":75698,"src_start":92},{"artifact":1,"gen_end":39900,"gen_start":39526,"node":26,"role":"declaration","source":0,"src_end":75698,"src_start":92},{"artifact":1,"gen_end":40586,"gen_start":39900,"node":27,"role":"declaration","source":0,"src_end":75698,"src_start":92},{"artifact":1,"gen_end":42022,"gen_start":40586,"node":28,"role":"declaration","source":0,"src_end":75698,"src_start":92},{"artifact":1,"gen_end":45526,"gen_start":42022,"node":29,"role":"declaration","source":0,"src_end":75698,"src_start":92},{"artifact":1,"gen_end":50804,"gen_start":45526,"node":30,"role":"declaration","source":0,"src_end":75698,"src_start":92},{"artifact":1,"gen_end":52064,"gen_start":50804,"node":31,"role":"declaration","source":0,"src_end":75698,"src_start":92},{"artifact":1,"gen_end":52499,"gen_start":52064,"node":32,"role":"declaration","source":0,"src_end":75698,"src_start":92},{"artifact":1,"gen_end":53059,"gen_start":52499,"node":33,"role":"declaration","source":0,"src_end":75698,"src_start":92},{"artifact":1,"gen_end":55003,"gen_start":53059,"node":34,"role":"declaration","source":0,"src_end":75698,"src_start":92},{"artifact":1,"gen_end":56283,"gen_start":55003,"node":35,"role":"declaration","source":0,"src_end":75698,"src_start":92},{"artifact":1,"gen_end":56497,"gen_start":56283,"node":36,"role":"declaration","source":0,"src_end":75698,"src_start":92},{"artifact":1,"gen_end":57223,"gen_start":56497,"node":37,"role":"declaration","source":0,"src_end":75698,"src_start":92},{"artifact":1,"gen_end":58544,"gen_start":57223,"node":38,"role":"declaration","source":0,"src_end":75698,"src_start":92},{"artifact":1,"gen_end":60254,"gen_start":58544,"node":39,"role":"declaration","source":0,"src_end":75698,"src_start":92},{"artifact":1,"gen_end":60695,"gen_start":60254,"node":40,"role":"declaration","source":0,"src_end":75698,"src_start":92},{"artifact":1,"gen_end":60710,"gen_start":60695,"node":41,"role":"declaration","source":0,"src_end":75698,"src_start":92}],"module":"Parameters","nodes":[{"id":0,"kind":"core-lean-kernel-module"},{"id":1,"kind":"core-latex-preamble"},{"id":2,"kind":"core-declaration"},{"id":3,"kind":"core-declaration"},{"id":4,"kind":"core-declaration"},{"id":5,"kind":"core-declaration"},{"id":6,"kind":"core-declaration"},{"id":7,"kind":"core-declaration"},{"id":8,"kind":"core-declaration"},{"id":9,"kind":"core-declaration"},{"id":10,"kind":"core-declaration"},{"id":11,"kind":"core-declaration"},{"id":12,"kind":"core-declaration"},{"id":13,"kind":"core-declaration"},{"id":14,"kind":"core-declaration"},{"id":15,"kind":"core-declaration"},{"id":16,"kind":"core-declaration"},{"id":17,"kind":"core-declaration"},{"id":18,"kind":"core-declaration"},{"id":19,"kind":"core-declaration"},{"id":20,"kind":"core-declaration"},{"id":21,"kind":"core-declaration"},{"id":22,"kind":"core-declaration"},{"id":23,"kind":"core-declaration"},{"id":24,"kind":"core-declaration"},{"id":25,"kind":"core-declaration"},{"id":26,"kind":"core-declaration"},{"id":27,"kind":"core-declaration"},{"id":28,"kind":"core-declaration"},{"id":29,"kind":"core-declaration"},{"id":30,"kind":"core-declaration"},{"id":31,"kind":"core-declaration"},{"id":32,"kind":"core-declaration"},{"id":33,"kind":"core-declaration"},{"id":34,"kind":"core-declaration"},{"id":35,"kind":"core-declaration"},{"id":36,"kind":"core-declaration"},{"id":37,"kind":"core-declaration"},{"id":38,"kind":"core-declaration"},{"id":39,"kind":"core-declaration"},{"id":40,"kind":"core-declaration"},{"id":41,"kind":"core-latex-preamble"}],"semantic_id":"3e85f0b2ffb33d52f9fadc68ec693fe067d5fa2bf61e9c9c30428c0fc9c12631","source_id":"5492d7db02ccfab20d0872082f0988e56512803da0ead2ae08ac18d379509035","sources":[{"id":0,"kind":"file","path":"src/Parameters.lex.tex","sha256":"60d19628c30e37c4c7ef76f4840480d5736007a8eeb4b6cfca42b81b2005442b"}],"spec":"lexlean/source-map/1"}
