{"artifacts":[{"id":0,"kind":"lean","path":"modules/SemanticFixture/VariantProofs.lean"},{"id":1,"kind":"tex","path":"modules/SemanticFixture/VariantProofs.tex"}],"mappings":[{"artifact":0,"gen_end":1606,"gen_start":0,"node":0,"role":"declaration","source":0,"src_end":3084,"src_start":0},{"artifact":1,"gen_end":1398,"gen_start":0,"node":1,"role":"declaration","source":0,"src_end":3084,"src_start":0}],"module":"VariantProofs","nodes":[{"id":0,"kind":"semantic-lean-module"},{"id":1,"kind":"semantic-latex-module"}],"semantic_id":"243c43c106986e9a5776d54d43e06f61e8b97e221e7f840be72341873f2266e4","source_id":"1b87a1b7992d1fac792b3fc6326d6e535283ab9c63647a59b85a4b447cda1ec3","sources":[{"id":0,"kind":"file","path":"src/VariantProofs.lex.tex","sha256":"c22d4373fd7091826f438c7fc89f884d113f9b8a0f54ea0172a3929f51ccb13a"}],"spec":"lexlean/source-map/1"}
