{"artifacts":[{"id":0,"kind":"lean","path":"modules/SemanticFixture/Support.lean"},{"id":1,"kind":"tex","path":"modules/SemanticFixture/Support.tex"}],"mappings":[{"artifact":0,"gen_end":230,"gen_start":0,"node":0,"role":"declaration","source":0,"src_end":521,"src_start":0},{"artifact":1,"gen_end":377,"gen_start":0,"node":1,"role":"declaration","source":0,"src_end":521,"src_start":0}],"module":"Support","nodes":[{"id":0,"kind":"semantic-lean-module"},{"id":1,"kind":"semantic-latex-module"}],"semantic_id":"243c43c106986e9a5776d54d43e06f61e8b97e221e7f840be72341873f2266e4","source_id":"1b87a1b7992d1fac792b3fc6326d6e535283ab9c63647a59b85a4b447cda1ec3","sources":[{"id":0,"kind":"file","path":"src/Support.lex.tex","sha256":"54dd29c5eb6d317252842a4596e27c8a6c667346e31d3b91f7a4714e3cf5b5c7"}],"spec":"lexlean/source-map/1"}
