{"artifacts":[{"id":0,"kind":"lean","path":"modules/SemanticFixture/Main.lean"},{"id":1,"kind":"tex","path":"modules/SemanticFixture/Main.tex"}],"mappings":[{"artifact":0,"gen_end":1868,"gen_start":0,"node":0,"role":"declaration","source":0,"src_end":4851,"src_start":0},{"artifact":1,"gen_end":2377,"gen_start":0,"node":1,"role":"declaration","source":0,"src_end":4851,"src_start":0}],"module":"Main","nodes":[{"id":0,"kind":"semantic-lean-module"},{"id":1,"kind":"semantic-latex-module"}],"semantic_id":"243c43c106986e9a5776d54d43e06f61e8b97e221e7f840be72341873f2266e4","source_id":"1b87a1b7992d1fac792b3fc6326d6e535283ab9c63647a59b85a4b447cda1ec3","sources":[{"id":0,"kind":"file","path":"src/Main.lex.tex","sha256":"23a0c9e083b4f25f0e8e0941e2068e4de71618353bc8900d0f15416b2de0c4eb"}],"spec":"lexlean/source-map/1"}
